Sheet: Table1
A1: year | B1: brand | C1: model | D1: units_sold | E1: estimated_revenue_million_usd | F1: avg_price_per_unit_usd
A2: 1997 | B2: Maruti | C2: 800 | D2: 100000 | E2: 400 | F2: 4000
A3: 1998 | B3: Maruti | C3: Zen | D3: 120000 | E3: 540 | F3: 4500
A4: 1999 | B4: Hyundai | C4: Santro | D4: 80000 | E4: 400 | F4: 5000
A5: 2000 | B5: Tata | C5: Indica | D5: 70000 | E5: 315 | F5: 4500
A6: 2001 | B6: Hyundai | C6: Accent | D6: 60000 | E6: 360 | F6: 6000
A7: 2002 | B7: Maruti | C7: WagonR | D7: 95000 | E7: 494 | F7: 5200 | N7: Row Labels | O7: Sum of units_sold | R7: Row Labels | S7: Sum of units_sold | V7: =AVERAGE(535200,75000) -> 305100
A8: 2003 | B8: Tata | C8: Indigo | D8: 80000 | E8: 384 | F8: 4800 | N8: Ford | O8: 75000 | R8: Aspire | S8: 117000 | V8: =1542605-535200 -> 1007405
A9: 2004 | B9: Hyundai | C9: Getz | D9: 50000 | E9: 310 | F9: 6200 | N9: Figo | O9: 75000 | R9: 2015 | S9: 34000 | V9: =SUM(R[-2]C:R[-1]C) -> 1312505
A10: 2005 | B10: Honda | C10: City | D10: 45000 | E10: 360 | F10: 8000 | N10: Honda | O10: 115000 | R10: 2016 | S10: 18000
A11: 2006 | B11: Maruti | C11: Swift | D11: 110000 | E11: 550 | F11: 5000 | N11: Amaze | O11: 70000 | R11: 2017 | S11: 20000
A12: 2007 | B12: Hyundai | C12: i10 | D12: 90000 | E12: 468 | F12: 5200 | N12: City | O12: 45000 | R12: 2018 | S12: 19000
A13: 2008 | B13: Tata | C13: Nano | D13: 60000 | E13: 150 | F13: 2500 | N13: Hyundai | O13: 527000 | R13: 2019 | S13: 16000
A14: 2009 | B14: Volkswagen | C14: Polo | D14: 40000 | E14: 280 | F14: 7000 | H14: Row Labels | I14: Sum of units_sold | J14: Sum of estimated_revenue_million_usd | K14: PERCENTAGE | N14: Accent | O14: 60000 | R14: 2020 | S14: 9000
A15: 2010 | B15: Ford | C15: Figo | D15: 75000 | E15: 450 | F15: 6000 | H15: Ford | I15: 75000 | J15: 450 | K15: 53.307766059443921 | L15: 16124 | N15: Creta | O15: 80000 | R15: 2021 | S15: 1000
A16: 2011 | B16: Hyundai | C16: Eon | D16: 85000 | E16: 408 | F16: 4800 | H16: Honda | I16: 115000 | J16: 990 | K16: 3.2730518729130158 | N16: Eon | O16: 85000 | R16: EcoSport | S16: 428800
A17: 2012 | B17: Renault | C17: Duster | D17: 65000 | E17: 650 | F17: 10000 | H17: Hyundai | I17: 527000 | J17: 3970 | K17: 13.125268621681489 | N17: Getz | O17: 50000 | R17: 2013 | S17: 40000
A18: 2013 | B18: Honda | C18: Amaze | D18: 70000 | E18: 630 | F18: 9000 | H18: Kia | I18: 135000 | J18: 2010 | K18: 6.6452871359143062 | N18: i10 | O18: 90000 | R18: 2014 | S18: 104000
A19: 2014 | B19: Maruti | C19: Celerio | D19: 90000 | E19: 450 | F19: 5000 | H19: Maruti | I19: 660000 | J19: 3304 | K19: 10.923397361721824 | N19: Santro | O19: 80000 | R19: 2015 | S19: 90000
A20: 2015 | B20: Hyundai | C20: Creta | D20: 80000 | E20: 1040 | F20: 13000 | H20: Renault | I20: 65000 | J20: 650 | K20: 2.1489734519125863 | N20: Venue | O20: 82000 | R20: 2016 | S20: 45000
A21: 2016 | B21: Tata | C21: Tiago | D21: 70000 | E21: 385 | F21: 5500 | H21: Tata | I21: 375000 | J21: 2469 | K21: 8.162793004264886 | N21: Kia | O21: 135000 | R21: 2017 | S21: 38000
A22: 2017 | B22: Kia | C22: Seltos | D22: 60000 | E22: 960 | F22: 16000 | H22: Volkswagen | I22: 40000 | J22: 280 | K22: 0.92571164082388346 | N22: Seltos | O22: 60000 | R22: 2018 | S22: 38000
A23: 2018 | B23: Maruti | C23: Swift | D23: 145000 | E23: 870 | F23: 6000 | H23: Grand Total | I23: 1992000 | J23: 14123 | K23: =16124+14123 -> 30247 | L23: =SUM(R[-8]C[-1]:R[-1]C[-1]) -> 98.512249148675892 | N23: Sonet | O23: 75000 | R23: 2019 | S23: 36000
A24: 2019 | B24: Hyundai | C24: Venue | D24: 82000 | E24: 984 | F24: 12000 | N24: Maruti | O24: 660000 | R24: 2020 | S24: 34000
A25: 2020 | B25: Kia | C25: Sonet | D25: 75000 | E25: 1050 | F25: 14000 | K25: =16124+14123 -> 30247 | N25: 800 | O25: 100000 | R25: 2021 | S25: 3800
A26: 2021 | B26: Tata | C26: Nexon | D26: 95000 | E26: 1235 | F26: 13000 | N26: Celerio | O26: 90000 | R26: Endeavour | S26: 20370
H27: Company | I27: Sum of units_sold | J27: Percenatge | N27: Swift | O27: 255000 | R27: 2011 | S27: 1270
H28: Ford | I28: 1312505 | J28: =(RC[-1]/R[8]C[-1])*100 -> 40.641057994955879 | N28: WagonR | O28: 95000 | R28: 2012 | S28: 1500
H29: Honda | I29: 115000 | J29: =(RC[-1]/R[7]C[-1])*100 -> 3.5609172303495424 | N29: Zen | O29: 120000 | R29: 2013 | S29: 1500
H30: Hyundai | I30: 527000 | J30: =(RC[-1]/R[6]C[-1])*100 -> 16.31829026429747 | N30: Renault | O30: 65000 | R30: 2014 | S30: 3000
H31: Kia | I31: 135000 | J31: =(RC[-1]/R[5]C[-1])*100 -> 4.1802071834538106 | N31: Duster | O31: 65000 | R31: 2015 | S31: 3600
H32: Maruti | I32: 660000 | J32: =(RC[-1]/R[4]C[-1])*100 -> 20.436568452440852 | N32: Tata | O32: 375000 | R32: 2016 | S32: 2500
H33: Renault | I33: 65000 | J33: =(RC[-1]/R[3]C[-1])*100 -> 2.0126923475888718 | N33: Indica | O33: 70000 | R33: 2017 | S33: 1800
H34: Tata | I34: 375000 | J34: =(RC[-1]/R[2]C[-1])*100 -> 11.611686620705031 | N34: Indigo | O34: 80000 | R34: 2018 | S34: 1700
H35: Volkswagen | I35: 40000 | J35: =(RC[-1]/R[1]C[-1])*100 -> 1.2385799062085365 | N35: Nano | O35: 60000 | R35: 2019 | S35: 1500
H36: Total | I36: =SUM(R[-8]C:R[-1]C) -> 3229505 | J36: =SUM(R[-8]C:R[-1]C) -> 100 | N36: Nexon | O36: 95000 | R36: 2020 | S36: 1200
N37: Tiago | O37: 70000 | R37: 2021 | S37: 800
N38: Volkswagen | O38: 40000 | R38: Escort | S38: 15866
N39: Polo | O39: 40000 | R39: 1997 | S39: 5428
N40: Grand Total | O40: 1992000 | R40: 1998 | S40: 10438
R41: Fiesta | S41: 258816
R42: 2005 | S42: 43352
R43: 2006 | S43: 42364
R44: 2007 | S44: 48237
R45: 2008 | S45: 29488
R46: 2009 | S46: 29488
R47: 2010 | S47: 23887
R48: 2011 | S48: 15000
R49: 2012 | S49: 15000
R50: 2013 | S50: 12000
R51: Figo | S51: 535200
R52: 2010 | S52: 60000
R53: 2011 | S53: 70000
R54: 2012 | S54: 75000
R55: 2013 | S55: 77000
R56: 2014 | S56: 86000
R57: 2015 | S57: 60000
R58: 2016 | S58: 32000
R59: 2017 | S59: 25000
R60: 2018 | S60: 21000
R61: 2019 | S61: 18000
R62: 2020 | S62: 10000
J63: Company | K63: PERCENTAGE | R63: 2021 | S63: 1200
J64: Ford | K64: 53.307766059443921 | R64: Freestyle | S64: 41900
J65: Honda | K65: 3.2730518729130158 | R65: 2018 | S65: 16000
J66: Hyundai | K66: 13.125268621681489 | R66: 2019 | S66: 15000
J67: Kia | K67: 6.6452871359143062 | R67: 2020 | S67: 10000
J68: Maruti | K68: 10.923397361721824 | R68: 2021 | S68: 900
J69: Renault | K69: 2.1489734519125863 | R69: Ikon | S69: 124653
J70: Tata | K70: 8.162793004264886 | R70: 1999 | S70: 14681
J71: Volkswagen | K71: 0.92571164082388346 | R71: 2000 | S71: 15266
R72: 2001 | S72: 18591
R73: 2002 | S73: 19067
R74: 2003 | S74: 26176
R75: 2004 | S75: 30872
R76: Grand Total | S76: 1542605