Sheet: Table1
A1: year | B1: country | C1: model | D1: units_sold | E1: estimated_revenue_million_usd
A2: 1997 | B2: United States | C2: F-150 | D2: 74776 | E2: 2175.31
A3: 1997 | B3: United States | C3: EcoSport | D3: 75608 | E3: 2950.68 | I3: Sum of units_sold | J3: Column Labels
A4: 1997 | B4: United States | C4: Focus | D4: 106545 | E4: 4772.8999999999996 | I4: Row Labels | J4: Australia | K4: Brazil | L4: China | M4: Germany | N4: India | O4: United Kingdom | P4: United States | Q4: Grand Total
A5: 1997 | B5: United States | C5: Endeavour | D5: 153773 | E5: 3151.27 | I5: EcoSport | J5: 804434 | K5: 670506 | L5: 1098353 | M5: 1220218 | N5: 1654365 | O5: 1490286 | P5: 686218 | Q5: 7624380
A6: 1997 | B6: India | C6: EcoSport | D6: 106702 | E6: 3345.96 | I6: Endeavour | J6: 852218 | K6: 1211648 | L6: 1558229 | M6: 1028383 | N6: 2252737 | O6: 1713995 | P6: 1458490 | Q6: 10075700
A7: 1997 | B7: India | C7: Fiesta | D7: 168586 | E7: 5736.31 | I7: F-150 | J7: 1109508 | K7: 1844310 | L7: 1439503 | M7: 1246671 | N7: 1247101 | O7: 757178 | P7: 1345284 | Q7: 8989555 | S7: 1312505
A8: 1997 | B8: India | C8: Ranger | D8: 123874 | E8: 4639.58 | I8: Fiesta | J8: 602924 | K8: 1529621 | L8: 995710 | M8: 474180 | N8: 987944 | O8: 1157554 | P8: 1720189 | Q8: 7468122 | S8: =R[-1]C-8237879 -> -6925374
A9: 1997 | B9: United Kingdom | C9: Fiesta | D9: 12217 | E9: 453.17 | I9: Focus | J9: 1223882 | K9: 1198094 | L9: 1217959 | M9: 1505029 | N9: 790355 | O9: 1547553 | P9: 1615089 | Q9: 9097961
A10: 1997 | B10: United Kingdom | C10: Ranger | D10: 23430 | E10: 430.9 | I10: Ranger | J10: 1716818 | K10: 1504749 | L10: 1697439 | M10: 1899071 | N10: 1305377 | O10: 1099673 | P10: 1581464 | Q10: 10804591
A11: 1997 | B11: United Kingdom | C11: Endeavour | D11: 82592 | E11: 1932.82 | I11: Grand Total | J11: 6309784 | K11: 7958928 | L11: 8007193 | M11: 7373552 | N11: 8237879 | O11: 7766239 | P11: 8406734 | Q11: 54060309
A12: 1997 | B12: Germany | C12: F-150 | D12: 110872 | E12: 2272.21
A13: 1997 | B13: Germany | C13: EcoSport | D13: 76913 | E13: 3359.79 | L13: Percentage
A14: 1997 | B14: Germany | C14: Ranger | D14: 95081 | E14: 3346.09 | J14: Australia | K14: 6309784 | L14: =(RC[-1]/R14C16)*100 -> 13.38663986701159 | O14: 54060309 | P14: =RC[-1]-6925374 -> 47134935
A15: 1997 | B15: Brazil | C15: F-150 | D15: 197283 | E15: 4930.3 | J15: Brazil | K15: 7958928 | L15: =(RC[-1]/R14C16)*100 -> 16.885412062199727 | O15: Country | P15: estimated_revenue_million_usd
A16: 1997 | B16: Brazil | C16: Fiesta | D16: 84240 | E16: 2305.65 | J16: China | K16: 8007193 | L16: =(RC[-1]/R14C16)*100 -> 16.987809572666219 | M16: =(8007193/54060309)*100 -> 14.811593104286548 | O16: #VALUE! | P16: 203858.55999999997
A17: 1997 | B17: Brazil | C17: Focus | D17: 125550 | E17: 2276.2199999999998 | J17: Germany | K17: 7373552 | L17: =(RC[-1]/R14C16)*100 -> 15.643496697301057 | M17: =(7373552/54060309)*100 -> 13.639492885621502 | O17: #VALUE! | P17: 243155.31999999992
A18: 1997 | B18: Brazil | C18: Ranger | D18: 68160 | E18: 2206.41 | J18: India | K18: 8237879 | L18: =(1312505/R[-4]C[3])*100 -> 2.4278533073127644 | M18: =(1312505/R[-4]C[3])*100 -> 2.7845694493903514 | O18: #VALUE! | P18: 261526.40999999995 | R18: 16124
A19: 1997 | B19: Australia | C19: F-150 | D19: 107047 | E19: 4490.3 | J19: United Kingdom | K19: 7766239 | L19: =(RC[-1]/R14C16)*100 -> 16.476609122299628 | O19: #VALUE! | P19: 232859.20000000007 | Q19: =AVERAGE(R[-1]C[1],RC[-1]) -> 124491.60000000003
A20: 1997 | B20: Australia | C20: Fiesta | D20: 17406 | E20: 315.64 | J20: United States | K20: 8406734 | L20: =(RC[-1]/R14C16)*100 -> 17.835463229131427 | O20: #VALUE! | P20: 261414.06999999998
A21: 1998 | B21: United States | C21: F-150 | D21: 104756 | E21: 3654.41 | L21: =SUM(R[-7]C:R[-1]C) -> 99.643283857922398 | O21: #VALUE! | P21: 243717.68000000002
A22: 1998 | B22: United States | C22: EcoSport | D22: 69956 | E22: 3050.22 | O22: #VALUE! | P22: 264035.43999999994
A23: 1998 | B23: United States | C23: Fiesta | D23: 182196 | E23: 7298.23 | P23: =SUM(R[-7]C:R[-1]C) -> 1710566.6799999997
A24: 1998 | B24: United States | C24: Ranger | D24: 32682 | E24: 682.47
A25: 1998 | B25: India | C25: Fiesta | D25: 84459 | E25: 3704.37 | G25: Row Labels | H25: Sum of estimated_revenue_million_usd
A26: 1998 | B26: India | C26: Focus | D26: 30574 | E26: 1202.48 | G26: Australia | H26: 203858.55999999997
A27: 1998 | B27: India | C27: Ranger | D27: 49393 | E27: 1157.92 | G27: Brazil | H27: 243155.31999999992
A28: 1998 | B28: India | C28: Endeavour | D28: 183426 | E28: 6267.67 | G28: China | H28: 261526.40999999995
A29: 1998 | B29: United Kingdom | C29: F-150 | D29: 52185 | E29: 1624.57 | G29: Germany | H29: 232859.20000000007
A30: 1998 | B30: Germany | C30: F-150 | D30: 43503 | E30: 911.3 | G30: India | H30: 261414.06999999998
A31: 1998 | B31: Germany | C31: EcoSport | D31: 44521 | E31: 1696.21 | G31: United Kingdom | H31: 243717.68000000002
A32: 1998 | B32: Germany | C32: Endeavour | D32: 179665 | E32: 6481.77 | G32: United States | H32: 264035.43999999994
A33: 1998 | B33: Brazil | C33: F-150 | D33: 80018 | E33: 2246.0300000000002 | G33: Grand Total | H33: 1710566.6799999997
A34: 1998 | B34: Brazil | C34: Focus | D34: 37620 | E34: 1465
A35: 1998 | B35: Brazil | C35: Endeavour | D35: 168045 | E35: 7453.13
A36: 1998 | B36: China | C36: F-150 | D36: 192537 | E36: 4666.33
A37: 1998 | B37: China | C37: Endeavour | D37: 132718 | E37: 3966.54
A38: 1998 | B38: Australia | C38: EcoSport | D38: 71529 | E38: 2198.16
A39: 1998 | B39: Australia | C39: Fiesta | D39: 42899 | E39: 1531.67
A40: 1998 | B40: Australia | C40: Focus | D40: 128474 | E40: 3767.89
A41: 1998 | B41: Australia | C41: Ranger | D41: 182803 | E41: 6874.49
A42: 1998 | B42: Australia | C42: Endeavour | D42: 8359 | E42: 356.74
A43: 1999 | B43: United States | C43: F-150 | D43: 49217 | E43: 1136.17
A44: 1999 | B44: United States | C44: EcoSport | D44: 52463 | E44: 1747.49
A45: 1999 | B45: United States | C45: Fiesta | D45: 118324 | E45: 4505.1899999999996
A46: 1999 | B46: United States | C46: Focus | D46: 182412 | E46: 6637.43
A47: 1999 | B47: United States | C47: Ranger | D47: 101940 | E47: 4543.47
A48: 1999 | B48: India | C48: F-150 | D48: 83557 | E48: 3193.8
A49: 1999 | B49: India | C49: EcoSport | D49: 99675 | E49: 1837.21
A50: 1999 | B50: India | C50: Ranger | D50: 30412 | E50: 694.64
A51: 1999 | B51: India | C51: Endeavour | D51: 89363 | E51: 2783.12
A52: 1999 | B52: United Kingdom | C52: F-150 | D52: 65273 | E52: 2098.14
A53: 1999 | B53: United Kingdom | C53: Ranger | D53: 34343 | E53: 849.3
A54: 1999 | B54: United Kingdom | C54: Endeavour | D54: 16626 | E54: 735.85
A55: 1999 | B55: Germany | C55: EcoSport | D55: 29819 | E55: 1017.28
A56: 1999 | B56: Germany | C56: Focus | D56: 189617 | E56: 3851.88
A57: 1999 | B57: Germany | C57: Ranger | D57: 150031 | E57: 3492.12
A58: 1999 | B58: Germany | C58: Endeavour | D58: 28765 | E58: 1119.82
A59: 1999 | B59: Brazil | C59: F-150 | D59: 178697 | E59: 5632.35
A60: 1999 | B60: Brazil | C60: EcoSport | D60: 90601 | E60: 3058.33
A61: 1999 | B61: Brazil | C61: Fiesta | D61: 96741 | E61: 2219.0500000000002
A62: 1999 | B62: Brazil | C62: Focus | D62: 66950 | E62: 2332.54
A63: 1999 | B63: Brazil | C63: Ranger | D63: 43639 | E63: 989.17
A64: 1999 | B64: China | C64: F-150 | D64: 130249 | E64: 5019.41
A65: 1999 | B65: Australia | C65: F-150 | D65: 47960 | E65: 1929.38
A66: 1999 | B66: Australia | C66: Ranger | D66: 22575 | E66: 842.63
A67: 1999 | B67: Australia | C67: Endeavour | D67: 105790 | E67: 4758.43
A68: 2000 | B68: United States | C68: EcoSport | D68: 7293 | E68: 146.30000000000001
A69: 2000 | B69: United States | C69: Fiesta | D69: 156531 | E69: 3191.82
A70: 2000 | B70: United States | C70: Focus | D70: 125559 | E70: 4090.84
A71: 2000 | B71: United States | C71: Endeavour | D71: 161705 | E71: 5260.75
A72: 2000 | B72: India | C72: Endeavour | D72: 189012 | E72: 4407.95
A73: 2000 | B73: United Kingdom | C73: EcoSport | D73: 26768 | E73: 784.14
A74: 2000 | B74: United Kingdom | C74: Fiesta | D74: 191684 | E74: 5042.25
A75: 2000 | B75: United Kingdom | C75: Endeavour | D75: 138435 | E75: 5846.39
A76: 2000 | B76: Germany | C76: EcoSport | D76: 124595 | E76: 4368.43
A77: 2000 | B77: Germany | C77: Fiesta | D77: 48660 | E77: 1673.37
A78: 2000 | B78: Germany | C78: Focus | D78: 20656 | E78: 400.29
A79: 2000 | B79: Germany | C79: Ranger | D79: 11219 | E79: 264.72000000000003
A80: 2000 | B80: Brazil | C80: F-150 | D80: 107874 | E80: 3238.7
A81: 2000 | B81: Brazil | C81: Focus | D81: 89563 | E81: 1874.64
A82: 2000 | B82: Brazil | C82: Ranger | D82: 140403 | E82: 4650.01
A83: 2000 | B83: China | C83: F-150 | D83: 173583 | E83: 7275.21
A84: 2000 | B84: China | C84: Fiesta | D84: 52265 | E84: 1917.5
A85: 2000 | B85: China | C85: Focus | D85: 17519 | E85: 591.74
A86: 2000 | B86: China | C86: Ranger | D86: 116478 | E86: 4559.3
A87: 2000 | B87: China | C87: Endeavour | D87: 137022 | E87: 2726.87
A88: 2000 | B88: Australia | C88: EcoSport | D88: 96985 | E88: 2306.89
A89: 2000 | B89: Australia | C89: Focus | D89: 123713 | E89: 5252.73
A90: 2000 | B90: Australia | C90: Endeavour | D90: 47675 | E90: 1962.11
A91: 2001 | B91: United States | C91: Fiesta | D91: 95144 | E91: 2628.07
A92: 2001 | B92: United States | C92: Focus | D92: 120422 | E92: 4805.4399999999996
A93: 2001 | B93: United States | C93: Ranger | D93: 78823 | E93: 2059.33
A94: 2001 | B94: United States | C94: Endeavour | D94: 67367 | E94: 1733.22
A95: 2001 | B95: India | C95: F-150 | D95: 6292 | E95: 123.22
A96: 2001 | B96: India | C96: EcoSport | D96: 48265 | E96: 2091.1799999999998
A97: 2001 | B97: India | C97: Focus | D97: 42632 | E97: 891.18
A98: 2001 | B98: India | C98: Ranger | D98: 129149 | E98: 5384.87
A99: 2001 | B99: United Kingdom | C99: EcoSport | D99: 147694 | E99: 3728.83
A100: 2001 | B100: United Kingdom | C100: Focus | D100: 41265 | E100: 854.14
A101: 2001 | B101: United Kingdom | C101: Endeavour | D101: 146481 | E101: 5388.16
A102: 2001 | B102: Germany | C102: EcoSport | D102: 23856 | E102: 912.09
A103: 2001 | B103: Germany | C103: Focus | D103: 40345 | E103: 1558.85
A104: 2001 | B104: Germany | C104: Ranger | D104: 128527 | E104: 3071.28
A105: 2001 | B105: Brazil | C105: Fiesta | D105: 177519 | E105: 6568.91
A106: 2001 | B106: Brazil | C106: Focus | D106: 74294 | E106: 1523.7
A107: 2001 | B107: Brazil | C107: Endeavour | D107: 156477 | E107: 3823.36
A108: 2001 | B108: China | C108: EcoSport | D108: 153914 | E108: 4285.2700000000004
A109: 2001 | B109: China | C109: Fiesta | D109: 36784 | E109: 1595.69
A110: 2001 | B110: China | C110: Ranger | D110: 199754 | E110: 3812.11
A111: 2001 | B111: China | C111: Endeavour | D111: 160291 | E111: 4070.27
A112: 2001 | B112: Australia | C112: F-150 | D112: 26886 | E112: 870.33
A113: 2001 | B113: Australia | C113: Fiesta | D113: 20492 | E113: 915.77
A114: 2001 | B114: Australia | C114: Ranger | D114: 81616 | E114: 1536.91
A115: 2001 | B115: Australia | C115: Endeavour | D115: 159097 | E115: 6011
A116: 2002 | B116: United States | C116: F-150 | D116: 183796 | E116: 3466.94
A117: 2002 | B117: United States | C117: Focus | D117: 81371 | E117: 3496.02
A118: 2002 | B118: United States | C118: Ranger | D118: 31158 | E118: 1295.24
A119: 2002 | B119: United States | C119: Endeavour | D119: 120533 | E119: 2211.7800000000002
A120: 2002 | B120: India | C120: F-150 | D120: 69757 | E120: 1661.82
A121: 2002 | B121: India | C121: Ranger | D121: 188115 | E121: 8106.63
A122: 2002 | B122: United Kingdom | C122: Fiesta | D122: 117168 | E122: 3172.56
A123: 2002 | B123: United Kingdom | C123: Focus | D123: 169010 | E123: 6160.08
A124: 2002 | B124: United Kingdom | C124: Ranger | D124: 132368 | E124: 2817.98
A125: 2002 | B125: United Kingdom | C125: Endeavour | D125: 49336 | E125: 1846.7
A126: 2002 | B126: Germany | C126: F-150 | D126: 188051 | E126: 4671.37
A127: 2002 | B127: Germany | C127: EcoSport | D127: 129239 | E127: 5531.82
A128: 2002 | B128: Germany | C128: Focus | D128: 160810 | E128: 3984.55
A129: 2002 | B129: Germany | C129: Ranger | D129: 83618 | E129: 2756.47
A130: 2002 | B130: Brazil | C130: EcoSport | D130: 159157 | E130: 3255.56
A131: 2002 | B131: Brazil | C131: Fiesta | D131: 126194 | E131: 3970.19
A132: 2002 | B132: China | C132: F-150 | D132: 6222 | E132: 233.82
A133: 2002 | B133: China | C133: Fiesta | D133: 68049 | E133: 2348.3000000000002
A134: 2002 | B134: China | C134: Focus | D134: 194151 | E134: 7180.87
A135: 2002 | B135: China | C135: Ranger | D135: 132531 | E135: 4789.41
A136: 2002 | B136: Australia | C136: F-150 | D136: 62664 | E136: 1292.3800000000001
A137: 2003 | B137: United States | C137: EcoSport | D137: 88710 | E137: 2468.44
A138: 2003 | B138: United States | C138: Ranger | D138: 140983 | E138: 2570.4
A139: 2003 | B139: United States | C139: Endeavour | D139: 80155 | E139: 2100.54
A140: 2003 | B140: India | C140: EcoSport | D140: 54900 | E140: 1675.88
A141: 2003 | B141: India | C141: Focus | D141: 65727 | E141: 1478.99
A142: 2003 | B142: India | C142: Endeavour | D142: 122944 | E142: 3954.25
A143: 2003 | B143: United Kingdom | C143: EcoSport | D143: 136767 | E143: 3129.37
A144: 2003 | B144: United Kingdom | C144: Fiesta | D144: 135433 | E144: 4206.82
A145: 2003 | B145: United Kingdom | C145: Focus | D145: 139361 | E145: 5336.97
A146: 2003 | B146: United Kingdom | C146: Endeavour | D146: 182016 | E146: 4638.68
A147: 2003 | B147: Germany | C147: EcoSport | D147: 152262 | E147: 3253.69
A148: 2003 | B148: Germany | C148: Focus | D148: 91581 | E148: 3636.68
A149: 2003 | B149: Brazil | C149: F-150 | D149: 199136 | E149: 5121.58
A150: 2003 | B150: Brazil | C150: Ranger | D150: 105497 | E150: 2584.36
A151: 2003 | B151: China | C151: EcoSport | D151: 16420 | E151: 401.93
A152: 2003 | B152: China | C152: Fiesta | D152: 18173 | E152: 681.71
A153: 2003 | B153: China | C153: Focus | D153: 77366 | E153: 3409.67
A154: 2003 | B154: China | C154: Endeavour | D154: 143743 | E154: 6002.71
A155: 2003 | B155: Australia | C155: Fiesta | D155: 65237 | E155: 2250.87
A156: 2003 | B156: Australia | C156: Focus | D156: 64752 | E156: 2464.0100000000002
A157: 2003 | B157: Australia | C157: Ranger | D157: 193210 | E157: 5463.79
A158: 2004 | B158: United States | C158: Ranger | D158: 81045 | E158: 2653.9
A159: 2004 | B159: India | C159: EcoSport | D159: 169365 | E159: 7382.45
A160: 2004 | B160: India | C160: Fiesta | D160: 55624 | E160: 1196.03
A161: 2004 | B161: India | C161: Focus | D161: 91285 | E161: 2543.66
A162: 2004 | B162: India | C162: Ranger | D162: 140434 | E162: 3477.29
A163: 2004 | B163: India | C163: Endeavour | D163: 104429 | E163: 4404.3999999999996
A164: 2004 | B164: United Kingdom | C164: EcoSport | D164: 49126 | E164: 938.85
A165: 2004 | B165: United Kingdom | C165: Ranger | D165: 93023 | E165: 2211.16
A166: 2004 | B166: United Kingdom | C166: Endeavour | D166: 177422 | E166: 6700.87
A167: 2004 | B167: Germany | C167: F-150 | D167: 150204 | E167: 4650.47
A168: 2004 | B168: Germany | C168: Endeavour | D168: 115648 | E168: 2723.39
A169: 2004 | B169: Brazil | C169: F-150 | D169: 127063 | E169: 3718.63
A170: 2004 | B170: Brazil | C170: Fiesta | D170: 144240 | E170: 2885.23
A171: 2004 | B171: China | C171: F-150 | D171: 6361 | E171: 257.14
A172: 2004 | B172: China | C172: Focus | D172: 149590 | E172: 3019.17
A173: 2004 | B173: China | C173: Endeavour | D173: 144429 | E173: 5066.8599999999997
A174: 2004 | B174: Australia | C174: EcoSport | D174: 13640 | E174: 399.15
A175: 2004 | B175: Australia | C175: Fiesta | D175: 188355 | E175: 5118.55
A176: 2004 | B176: Australia | C176: Focus | D176: 144549 | E176: 2650.02
A177: 2004 | B177: Australia | C177: Endeavour | D177: 146534 | E177: 3823.51
A178: 2005 | B178: United States | C178: Fiesta | D178: 129939 | E178: 3911.68
A179: 2005 | B179: United States | C179: Endeavour | D179: 22355 | E179: 848.53
A180: 2005 | B180: India | C180: EcoSport | D180: 137696 | E180: 2793.03
A181: 2005 | B181: India | C181: Endeavour | D181: 197468 | E181: 7876.8
A182: 2005 | B182: United Kingdom | C182: EcoSport | D182: 191301 | E182: 7307.89
A183: 2005 | B183: United Kingdom | C183: Focus | D183: 134007 | E183: 3741.74
A184: 2005 | B184: United Kingdom | C184: Endeavour | D184: 76518 | E184: 2881.51
A185: 2005 | B185: Germany | C185: F-150 | D185: 5758 | E185: 117.91
A186: 2005 | B186: Germany | C186: EcoSport | D186: 163596 | E186: 6674.23
A187: 2005 | B187: Germany | C187: Ranger | D187: 46511 | E187: 864.55
A188: 2005 | B188: Germany | C188: Endeavour | D188: 18023 | E188: 809.76
A189: 2005 | B189: Brazil | C189: Focus | D189: 59597 | E189: 1646.13
A190: 2005 | B190: China | C190: F-150 | D190: 112520 | E190: 3822.53
A191: 2005 | B191: China | C191: Fiesta | D191: 56896 | E191: 1911.02
A192: 2005 | B192: China | C192: Ranger | D192: 115902 | E192: 4846.79
A193: 2005 | B193: Australia | C193: EcoSport | D193: 109062 | E193: 4235.6400000000003
A194: 2005 | B194: Australia | C194: Ranger | D194: 124502 | E194: 4260.71
A195: 2005 | B195: Australia | C195: Endeavour | D195: 37371 | E195: 1546.37
A196: 2006 | B196: United States | C196: F-150 | D196: 44346 | E196: 1697.92
A197: 2006 | B197: United States | C197: Fiesta | D197: 190253 | E197: 8364.09
A198: 2006 | B198: United States | C198: Focus | D198: 37811 | E198: 830.33
A199: 2006 | B199: India | C199: F-150 | D199: 74308 | E199: 1880.44
A200: 2006 | B200: India | C200: EcoSport | D200: 35544 | E200: 949.38
A201: 2006 | B201: India | C201: Endeavour | D201: 45216 | E201: 1376.06
A202: 2006 | B202: United Kingdom | C202: Focus | D202: 111780 | E202: 3026.78
A203: 2006 | B203: United Kingdom | C203: Ranger | D203: 86939 | E203: 1825.2
A204: 2006 | B204: Germany | C204: Ranger | D204: 93661 | E204: 1903.94
A205: 2006 | B205: Brazil | C205: F-150 | D205: 28280 | E205: 1252.24
A206: 2006 | B206: Brazil | C206: EcoSport | D206: 74899 | E206: 2926.98
A207: 2006 | B207: Brazil | C207: Fiesta | D207: 193010 | E207: 5815.58
A208: 2006 | B208: Brazil | C208: Focus | D208: 61418 | E208: 1283.6400000000001
A209: 2006 | B209: Brazil | C209: Ranger | D209: 13889 | E209: 511.05
A210: 2006 | B210: Brazil | C210: Endeavour | D210: 156973 | E210: 4752.99
A211: 2006 | B211: China | C211: EcoSport | D211: 147777 | E211: 2691.91
A212: 2006 | B212: China | C212: Fiesta | D212: 105929 | E212: 3306.15
A213: 2006 | B213: China | C213: Focus | D213: 59659 | E213: 1727.25
A214: 2006 | B214: China | C214: Ranger | D214: 157086 | E214: 4840.76
A215: 2006 | B215: Australia | C215: F-150 | D215: 163954 | E215: 3559.44
A216: 2006 | B216: Australia | C216: Fiesta | D216: 132241 | E216: 2655
A217: 2006 | B217: Australia | C217: Focus | D217: 40988 | E217: 1512.13
A218: 2006 | B218: Australia | C218: Ranger | D218: 102741 | E218: 3764.53
A219: 2007 | B219: United States | C219: EcoSport | D219: 137537 | E219: 5856.46
A220: 2007 | B220: United States | C220: Focus | D220: 191544 | E220: 4362.22
A221: 2007 | B221: India | C221: EcoSport | D221: 90636 | E221: 2085.2600000000002
A222: 2007 | B222: India | C222: Endeavour | D222: 169237 | E222: 7559.82
A223: 2007 | B223: United Kingdom | C223: F-150 | D223: 37597 | E223: 1326.5
A224: 2007 | B224: United Kingdom | C224: EcoSport | D224: 117073 | E224: 3215.64
A225: 2007 | B225: United Kingdom | C225: Fiesta | D225: 197826 | E225: 6166.24
A226: 2007 | B226: United Kingdom | C226: Focus | D226: 41076 | E226: 837.38
A227: 2007 | B227: United Kingdom | C227: Ranger | D227: 69154 | E227: 2029.25
A228: 2007 | B228: United Kingdom | C228: Endeavour | D228: 30160 | E228: 643.70000000000005
A229: 2007 | B229: Germany | C229: F-150 | D229: 117725 | E229: 3706.45
A230: 2007 | B230: Germany | C230: Fiesta | D230: 52799 | E230: 1414.06
A231: 2007 | B231: Germany | C231: Focus | D231: 96989 | E231: 2945.75
A232: 2007 | B232: Brazil | C232: Fiesta | D232: 42117 | E232: 1110.71
A233: 2007 | B233: Brazil | C233: Ranger | D233: 149332 | E233: 4942.59
A234: 2007 | B234: China | C234: Focus | D234: 40554 | E234: 1076.8699999999999
A235: 2007 | B235: China | C235: Endeavour | D235: 51929 | E235: 1380.64
A236: 2007 | B236: Australia | C236: Endeavour | D236: 91991 | E236: 2398.3000000000002
A237: 2008 | B237: United States | C237: F-150 | D237: 63175 | E237: 1937.07
A238: 2008 | B238: United States | C238: Fiesta | D238: 185993 | E238: 7405.87
A239: 2008 | B239: United States | C239: Ranger | D239: 164616 | E239: 3939.75
A240: 2008 | B240: India | C240: Endeavour | D240: 162288 | E240: 5523.15
A241: 2008 | B241: United Kingdom | C241: F-150 | D241: 27711 | E241: 904.07
A242: 2008 | B242: United Kingdom | C242: EcoSport | D242: 173168 | E242: 4397.43
A243: 2008 | B243: United Kingdom | C243: Fiesta | D243: 84908 | E243: 3087.68
A244: 2008 | B244: United Kingdom | C244: Endeavour | D244: 103467 | E244: 2267.17
A245: 2008 | B245: Germany | C245: EcoSport | D245: 117652 | E245: 5148.57
A246: 2008 | B246: Germany | C246: Focus | D246: 14512 | E246: 265.45
A247: 2008 | B247: Brazil | C247: F-150 | D247: 144659 | E247: 5669.19
A248: 2008 | B248: Brazil | C248: Endeavour | D248: 30619 | E248: 863.21
A249: 2008 | B249: China | C249: F-150 | D249: 50164 | E249: 1956.9
A250: 2008 | B250: China | C250: EcoSport | D250: 123015 | E250: 3651.82
A251: 2008 | B251: China | C251: Focus | D251: 161049 | E251: 7071.02
A252: 2008 | B252: China | C252: Ranger | D252: 143923 | E252: 6208.98
A253: 2008 | B253: China | C253: Endeavour | D253: 125313 | E253: 4474.68
A254: 2008 | B254: Australia | C254: F-150 | D254: 190418 | E254: 5697.31
A255: 2008 | B255: Australia | C255: EcoSport | D255: 18927 | E255: 501.26
A256: 2008 | B256: Australia | C256: Focus | D256: 168872 | E256: 5889.41
A257: 2009 | B257: United States | C257: Fiesta | D257: 54796 | E257: 2429.87
A258: 2009 | B258: United States | C258: Ranger | D258: 115117 | E258: 2954.25
A259: 2009 | B259: India | C259: F-150 | D259: 42906 | E259: 1850.49
A260: 2009 | B260: India | C260: EcoSport | D260: 88545 | E260: 3918.2
A261: 2009 | B261: India | C261: Fiesta | D261: 181123 | E261: 7203.62
A262: 2009 | B262: India | C262: Ranger | D262: 51508 | E262: 1344.62
A263: 2009 | B263: United Kingdom | C263: Focus | D263: 101662 | E263: 2370.5500000000002
A264: 2009 | B264: United Kingdom | C264: Endeavour | D264: 59741 | E264: 1631.23
A265: 2009 | B265: Germany | C265: EcoSport | D265: 60895 | E265: 2494.44
A266: 2009 | B266: Germany | C266: Focus | D266: 127348 | E266: 2960.33
A267: 2009 | B267: Germany | C267: Ranger | D267: 160333 | E267: 4840.93
A268: 2009 | B268: Brazil | C268: Ranger | D268: 7959 | E268: 156.41999999999999
A269: 2009 | B269: Brazil | C269: Endeavour | D269: 12198 | E269: 314.87
A270: 2009 | B270: China | C270: Focus | D270: 77747 | E270: 2221.08
A271: 2009 | B271: China | C271: Ranger | D271: 174718 | E271: 7397.21
A272: 2009 | B272: Australia | C272: F-150 | D272: 145967 | E272: 6284.46
A273: 2009 | B273: Australia | C273: EcoSport | D273: 98064 | E273: 3727.8
A274: 2009 | B274: Australia | C274: Focus | D274: 143812 | E274: 6141.06
A275: 2009 | B275: Australia | C275: Ranger | D275: 38613 | E275: 1481.74
A276: 2010 | B276: United States | C276: F-150 | D276: 155686 | E276: 4177.21
A277: 2010 | B277: United States | C277: EcoSport | D277: 45012 | E277: 1692.63
A278: 2010 | B278: United States | C278: Focus | D278: 189830 | E278: 3517.36
A279: 2010 | B279: United States | C279: Endeavour | D279: 155692 | E279: 6939.66
A280: 2010 | B280: India | C280: EcoSport | D280: 167733 | E280: 3562.82
A281: 2010 | B281: India | C281: Fiesta | D281: 116544 | E281: 2334.61
A282: 2010 | B282: India | C282: Focus | D282: 91431 | E282: 4092.63
A283: 2010 | B283: India | C283: Endeavour | D283: 101386 | E283: 3121.98
A284: 2010 | B284: United Kingdom | C284: EcoSport | D284: 152232 | E284: 4386.1099999999997
A285: 2010 | B285: United Kingdom | C285: Fiesta | D285: 10690 | E285: 461.49
A286: 2010 | B286: Germany | C286: EcoSport | D286: 141115 | E286: 5886.61
A287: 2010 | B287: Germany | C287: Ranger | D287: 73386 | E287: 2650.92
A288: 2010 | B288: Brazil | C288: F-150 | D288: 102486 | E288: 4445.95
A289: 2010 | B289: Brazil | C289: EcoSport | D289: 128523 | E289: 3335.69
A290: 2010 | B290: Brazil | C290: Fiesta | D290: 32420 | E290: 1414.94
A291: 2010 | B291: Brazil | C291: Ranger | D291: 175833 | E291: 6518.31
A292: 2010 | B292: Brazil | C292: Endeavour | D292: 9145 | E292: 208.09
A293: 2010 | B293: China | C293: EcoSport | D293: 94312 | E293: 2413.54
A294: 2010 | B294: China | C294: Fiesta | D294: 114021 | E294: 4592.42
A295: 2010 | B295: Australia | C295: Ranger | D295: 188194 | E295: 4107.8999999999996
A296: 2011 | B296: United States | C296: Fiesta | D296: 197667 | E296: 5435.84
A297: 2011 | B297: United States | C297: Focus | D297: 133068 | E297: 3040.34
A298: 2011 | B298: United States | C298: Ranger | D298: 188469 | E298: 7131.67
A299: 2011 | B299: India | C299: Ranger | D299: 92226 | E299: 3099.99
A300: 2011 | B300: India | C300: Endeavour | D300: 64687 | E300: 1365.03
A301: 2011 | B301: United Kingdom | C301: F-150 | D301: 59525 | E301: 2527.4899999999998
A302: 2011 | B302: United Kingdom | C302: Fiesta | D302: 53136 | E302: 1613.42
A303: 2011 | B303: United Kingdom | C303: Focus | D303: 48482 | E303: 2030.18
A304: 2011 | B304: United Kingdom | C304: Endeavour | D304: 18737 | E304: 361.7
A305: 2011 | B305: Germany | C305: Endeavour | D305: 138239 | E305: 5358.42
A306: 2011 | B306: Brazil | C306: Focus | D306: 184817 | E306: 7975.96
A307: 2011 | B307: Brazil | C307: Endeavour | D307: 193191 | E307: 6643.26
A308: 2011 | B308: China | C308: F-150 | D308: 157459 | E308: 4946.57
A309: 2011 | B309: China | C309: EcoSport | D309: 104647 | E309: 3018.54
A310: 2011 | B310: China | C310: Ranger | D310: 66191 | E310: 2564.44
A311: 2011 | B311: Australia | C311: EcoSport | D311: 21135 | E311: 458.33
A312: 2011 | B312: Australia | C312: Ranger | D312: 74630 | E312: 2094.64
A313: 2012 | B313: United States | C313: F-150 | D313: 171052 | E313: 7276.89
A314: 2012 | B314: United States | C314: Fiesta | D314: 61138 | E314: 2595.67
A315: 2012 | B315: United States | C315: Focus | D315: 157826 | E315: 5033.8599999999997
A316: 2012 | B316: India | C316: F-150 | D316: 128943 | E316: 4474.71
A317: 2012 | B317: India | C317: EcoSport | D317: 104681 | E317: 3458.35
A318: 2012 | B318: India | C318: Focus | D318: 49062 | E318: 1176.5999999999999
A319: 2012 | B319: India | C319: Endeavour | D319: 147723 | E319: 3085.93
A320: 2012 | B320: United Kingdom | C320: EcoSport | D320: 151076 | E320: 5868.25
A321: 2012 | B321: United Kingdom | C321: Focus | D321: 189275 | E321: 6009.29
A322: 2012 | B322: United Kingdom | C322: Ranger | D322: 163836 | E322: 5618.1
A323: 2012 | B323: United Kingdom | C323: Endeavour | D323: 108362 | E323: 4131.41
A324: 2012 | B324: Germany | C324: EcoSport | D324: 33458 | E324: 729.82
A325: 2012 | B325: Germany | C325: Fiesta | D325: 96936 | E325: 2620.1799999999998
A326: 2012 | B326: Germany | C326: Focus | D326: 131847 | E326: 3005.06
A327: 2012 | B327: Germany | C327: Ranger | D327: 94097 | E327: 3706.48
A328: 2012 | B328: Brazil | C328: EcoSport | D328: 188619 | E328: 5957.53
A329: 2012 | B329: Brazil | C329: Fiesta | D329: 53954 | E329: 1353.38
A330: 2012 | B330: Brazil | C330: Focus | D330: 133756 | E330: 4117.95
A331: 2012 | B331: Brazil | C331: Ranger | D331: 143625 | E331: 5903.42
A332: 2012 | B332: Brazil | C332: Endeavour | D332: 57840 | E332: 1446.81
A333: 2012 | B333: China | C333: F-150 | D333: 82641 | E333: 2621.29
A334: 2012 | B334: China | C334: EcoSport | D334: 76262 | E334: 2413.77
A335: 2012 | B335: China | C335: Focus | D335: 130971 | E335: 3878.18
A336: 2012 | B336: China | C336: Endeavour | D336: 61040 | E336: 1390.31
A337: 2012 | B337: Australia | C337: EcoSport | D337: 121924 | E337: 3938.39
A338: 2012 | B338: Australia | C338: Focus | D338: 36826 | E338: 1387.86
A339: 2012 | B339: Australia | C339: Ranger | D339: 166061 | E339: 4599.3900000000003
A340: 2013 | B340: United States | C340: F-150 | D340: 87630 | E340: 2758.24
A341: 2013 | B341: United States | C341: EcoSport | D341: 16725 | E341: 741
A342: 2013 | B342: United States | C342: Ranger | D342: 151933 | E342: 3377.47
A343: 2013 | B343: India | C343: F-150 | D343: 170122 | E343: 4484.76
A344: 2013 | B344: India | C344: Fiesta | D344: 80042 | E344: 2103.1799999999998
A345: 2013 | B345: India | C345: Ranger | D345: 132875 | E345: 5150.1000000000004
A346: 2013 | B346: United Kingdom | C346: F-150 | D346: 40610 | E346: 1343.18
A347: 2013 | B347: United Kingdom | C347: EcoSport | D347: 198865 | E347: 7377.1
A348: 2013 | B348: United Kingdom | C348: Focus | D348: 158205 | E348: 5764.36
A349: 2013 | B349: United Kingdom | C349: Ranger | D349: 178544 | E349: 5376.5
A350: 2013 | B350: United Kingdom | C350: Endeavour | D350: 153695 | E350: 6872.78
A351: 2013 | B351: Germany | C351: F-150 | D351: 64630 | E351: 2249.5100000000002
A352: 2013 | B352: Germany | C352: Fiesta | D352: 57754 | E352: 2400.1999999999998
A353: 2013 | B353: Germany | C353: Ranger | D353: 143956 | E353: 5586.79
A354: 2013 | B354: Germany | C354: Endeavour | D354: 165512 | E354: 4189.7700000000004
A355: 2013 | B355: Brazil | C355: F-150 | D355: 145360 | E355: 4859.24
A356: 2013 | B356: Brazil | C356: EcoSport | D356: 10662 | E356: 367.84
A357: 2013 | B357: Brazil | C357: Fiesta | D357: 99386 | E357: 2506.61
A358: 2013 | B358: Brazil | C358: Focus | D358: 107727 | E358: 4657.68
A359: 2013 | B359: Brazil | C359: Ranger | D359: 67477 | E359: 1309.53
A360: 2013 | B360: China | C360: F-150 | D360: 111042 | E360: 2070.27
A361: 2013 | B361: China | C361: Fiesta | D361: 184177 | E361: 7562.86
A362: 2013 | B362: China | C362: Focus | D362: 110786 | E362: 2667.28
A363: 2013 | B363: Australia | C363: F-150 | D363: 62118 | E363: 1198.3800000000001
A364: 2013 | B364: Australia | C364: EcoSport | D364: 79105 | E364: 2589.98
A365: 2014 | B365: United States | C365: F-150 | D365: 162631 | E365: 7251.07
A366: 2014 | B366: United States | C366: Fiesta | D366: 89301 | E366: 2432.83
A367: 2014 | B367: United States | C367: Ranger | D367: 154967 | E367: 5148.3100000000004
A368: 2014 | B368: India | C368: Ranger | D368: 50124 | E368: 1077.92
A369: 2014 | B369: United Kingdom | C369: F-150 | D369: 54974 | E369: 1525.91
A370: 2014 | B370: United Kingdom | C370: EcoSport | D370: 59144 | E370: 1687.91
A371: 2014 | B371: United Kingdom | C371: Fiesta | D371: 182702 | E371: 4393.8
A372: 2014 | B372: United Kingdom | C372: Ranger | D372: 161664 | E372: 5030.01
A373: 2014 | B373: United Kingdom | C373: Endeavour | D373: 36186 | E373: 956.07
A374: 2014 | B374: Germany | C374: EcoSport | D374: 27145 | E374: 492.17
A375: 2014 | B375: Germany | C375: Focus | D375: 73585 | E375: 2889.39
A376: 2014 | B376: Germany | C376: Ranger | D376: 117387 | E376: 3427.23
A377: 2014 | B377: Germany | C377: Endeavour | D377: 120582 | E377: 4580.67
A378: 2014 | B378: Brazil | C378: Focus | D378: 136700 | E378: 3991.91
A379: 2014 | B379: China | C379: Ranger | D379: 79033 | E379: 1530.16
A380: 2014 | B380: Australia | C380: Focus | D380: 186772 | E380: 5456.36
A381: 2014 | B381: Australia | C381: Ranger | D381: 36434 | E381: 1005.83
A382: 2014 | B382: Australia | C382: Endeavour | D382: 46774 | E382: 1328.57
A383: 2015 | B383: United States | C383: Fiesta | D383: 168362 | E383: 4607.8999999999996
A384: 2015 | B384: United States | C384: Ranger | D384: 88945 | E384: 2879.77
A385: 2015 | B385: United States | C385: Endeavour | D385: 73375 | E385: 3013.95
A386: 2015 | B386: India | C386: F-150 | D386: 138807 | E386: 3689.63
A387: 2015 | B387: India | C387: EcoSport | D387: 119067 | E387: 4159.49
A388: 2015 | B388: India | C388: Focus | D388: 79238 | E388: 3050.35
A389: 2015 | B389: India | C389: Ranger | D389: 40879 | E389: 1507.66
A390: 2015 | B390: United Kingdom | C390: F-150 | D390: 127403 | E390: 3869.48
A391: 2015 | B391: United Kingdom | C391: Focus | D391: 13952 | E391: 552.92999999999995
A392: 2015 | B392: Germany | C392: Focus | D392: 67706 | E392: 3036
A393: 2015 | B393: Germany | C393: Ranger | D393: 31205 | E393: 1318.63
A394: 2015 | B394: Brazil | C394: Fiesta | D394: 106243 | E394: 3268.99
A395: 2015 | B395: Brazil | C395: Ranger | D395: 150150 | E395: 2804.5
A396: 2015 | B396: Brazil | C396: Endeavour | D396: 121687 | E396: 2787.73
A397: 2015 | B397: China | C397: EcoSport | D397: 187203 | E397: 3903.56
A398: 2015 | B398: China | C398: Ranger | D398: 142533 | E398: 3819.46
A399: 2015 | B399: Australia | C399: F-150 | D399: 62072 | E399: 1721.88
A400: 2015 | B400: Australia | C400: Endeavour | D400: 179862 | E400: 6434.02
A401: 2016 | B401: United States | C401: EcoSport | D401: 23177 | E401: 1005.86
A402: 2016 | B402: United States | C402: Focus | D402: 60881 | E402: 2731.37
A403: 2016 | B403: United States | C403: Endeavour | D403: 96722 | E403: 3040.75
A404: 2016 | B404: India | C404: F-150 | D404: 72172 | E404: 2648.57
A405: 2016 | B405: India | C405: EcoSport | D405: 146327 | E405: 4817.96
A406: 2016 | B406: India | C406: Ranger | D406: 157744 | E406: 3184.22
A407: 2016 | B407: India | C407: Endeavour | D407: 175431 | E407: 5866.41
A408: 2016 | B408: United Kingdom | C408: EcoSport | D408: 22449 | E408: 482.74
A409: 2016 | B409: United Kingdom | C409: Fiesta | D409: 78895 | E409: 2299.16
A410: 2016 | B410: United Kingdom | C410: Focus | D410: 152708 | E410: 6126.19
A411: 2016 | B411: United Kingdom | C411: Endeavour | D411: 93772 | E411: 1797.89
A412: 2016 | B412: Germany | C412: F-150 | D412: 163209 | E412: 5740.88
A413: 2016 | B413: Germany | C413: Focus | D413: 60771 | E413: 2669.24
A414: 2016 | B414: Germany | C414: Ranger | D414: 135098 | E414: 4857.45
A415: 2016 | B415: Germany | C415: Endeavour | D415: 89701 | E415: 3911.32
A416: 2016 | B416: Brazil | C416: Fiesta | D416: 53920 | E416: 2421.6
A417: 2016 | B417: Brazil | C417: Ranger | D417: 159360 | E417: 4443.28
A418: 2016 | B418: China | C418: F-150 | D418: 164378 | E418: 7017.95
A419: 2016 | B419: China | C419: Focus | D419: 86434 | E419: 3887.71
A420: 2016 | B420: China | C420: Ranger | D420: 133129 | E420: 3765.55
A421: 2016 | B421: China | C421: Endeavour | D421: 103411 | E421: 4318.96
A422: 2016 | B422: Australia | C422: F-150 | D422: 179766 | E422: 6973.3
A423: 2016 | B423: Australia | C423: Fiesta | D423: 103862 | E423: 4274.8599999999997
A424: 2016 | B424: Australia | C424: Focus | D424: 42591 | E424: 1258.52
A425: 2016 | B425: Australia | C425: Ranger | D425: 152350 | E425: 3286.49
A426: 2017 | B426: United States | C426: F-150 | D426: 15020 | E426: 619.44000000000005
A427: 2017 | B427: United States | C427: Focus | D427: 34016 | E427: 1235.29
A428: 2017 | B428: United States | C428: Ranger | D428: 71372 | E428: 1378.41
A429: 2017 | B429: United States | C429: Endeavour | D429: 189464 | E429: 5694.72
A430: 2017 | B430: India | C430: F-150 | D430: 152475 | E430: 6651.42
A431: 2017 | B431: India | C431: EcoSport | D431: 118377 | E431: 2309.42
A432: 2017 | B432: India | C432: Fiesta | D432: 141383 | E432: 3791.19
A433: 2017 | B433: India | C433: Focus | D433: 8028 | E433: 290.36
A434: 2017 | B434: India | C434: Ranger | D434: 97697 | E434: 2530.16
A435: 2017 | B435: India | C435: Endeavour | D435: 189859 | E435: 4964.8100000000004
A436: 2017 | B436: United Kingdom | C436: F-150 | D436: 198745 | E436: 6810.39
A437: 2017 | B437: United Kingdom | C437: Focus | D437: 7102 | E437: 230.22
A438: 2017 | B438: United Kingdom | C438: Ranger | D438: 63614 | E438: 2384.63
A439: 2017 | B439: United Kingdom | C439: Endeavour | D439: 108854 | E439: 3924.19
A440: 2017 | B440: Germany | C440: F-150 | D440: 94547 | E440: 2881.6
A441: 2017 | B441: Germany | C441: EcoSport | D441: 39159 | E441: 1200.07
A442: 2017 | B442: Germany | C442: Fiesta | D442: 128838 | E442: 4793.8
A443: 2017 | B443: Germany | C443: Focus | D443: 79283 | E443: 2014.18
A444: 2017 | B444: Germany | C444: Endeavour | D444: 107167 | E444: 2532.25
A445: 2017 | B445: Brazil | C445: F-150 | D445: 102993 | E445: 4264.43
A446: 2017 | B446: Brazil | C446: Focus | D446: 20934 | E446: 808.74
A447: 2017 | B447: Brazil | C447: Endeavour | D447: 50602 | E447: 1106.06
A448: 2017 | B448: China | C448: Ranger | D448: 55825 | E448: 1190.8599999999999
A449: 2017 | B449: China | C449: Endeavour | D449: 122339 | E449: 3433.81
A450: 2017 | B450: Australia | C450: F-150 | D450: 60656 | E450: 1966.71
A451: 2017 | B451: Australia | C451: Focus | D451: 25492 | E451: 1030
A452: 2017 | B452: Australia | C452: Ranger | D452: 37435 | E452: 723.77
A453: 2018 | B453: United States | C453: Endeavour | D453: 144851 | E453: 6129.08
A454: 2018 | B454: India | C454: F-150 | D454: 8393 | E454: 229.68
A455: 2018 | B455: India | C455: Focus | D455: 184891 | E455: 6929.16
A456: 2018 | B456: India | C456: Endeavour | D456: 102754 | E456: 4499.29
A457: 2018 | B457: United Kingdom | C457: F-150 | D457: 87044 | E457: 2428.96
A458: 2018 | B458: United Kingdom | C458: Fiesta | D458: 32998 | E458: 671.15
A459: 2018 | B459: United Kingdom | C459: Endeavour | D459: 25745 | E459: 500.84
A460: 2018 | B460: Germany | C460: Focus | D460: 11895 | E460: 355.48
A461: 2018 | B461: Germany | C461: Ranger | D461: 163548 | E461: 6320.8
A462: 2018 | B462: Brazil | C462: F-150 | D462: 114188 | E462: 3924.18
A463: 2018 | B463: Brazil | C463: Fiesta | D463: 160245 | E463: 6709.3
A464: 2018 | B464: Brazil | C464: Endeavour | D464: 188029 | E464: 8081.49
A465: 2018 | B465: China | C465: EcoSport | D465: 194803 | E465: 6245.97
A466: 2018 | B466: China | C466: Fiesta | D466: 97284 | E466: 2509.34
A467: 2018 | B467: China | C467: Focus | D467: 112133 | E467: 4685.25
A468: 2018 | B468: China | C468: Ranger | D468: 180336 | E468: 5544.97
A469: 2018 | B469: China | C469: Endeavour | D469: 80821 | E469: 3235.35
A470: 2018 | B470: Australia | C470: Focus | D470: 81790 | E470: 3022.39
A471: 2018 | B471: Australia | C471: Endeavour | D471: 28765 | E471: 1231.4000000000001
A472: 2019 | B472: United States | C472: F-150 | D472: 23310 | E472: 963.08
A473: 2019 | B473: United States | C473: Focus | D473: 193804 | E473: 5281.55
A474: 2019 | B474: United States | C474: Ranger | D474: 179414 | E474: 3517.23
A475: 2019 | B475: India | C475: F-150 | D475: 179262 | E475: 5794.46
A476: 2019 | B476: India | C476: EcoSport | D476: 93821 | E476: 4047.72
A477: 2019 | B477: India | C477: Endeavour | D477: 100948 | E477: 2712.67
A478: 2019 | B478: United Kingdom | C478: Fiesta | D478: 59897 | E478: 2118.92
A479: 2019 | B479: United Kingdom | C479: Focus | D479: 40102 | E479: 1221.19
A480: 2019 | B480: Germany | C480: F-150 | D480: 112130 | E480: 4060.68
A481: 2019 | B481: Germany | C481: Fiesta | D481: 89193 | E481: 2375.66
A482: 2019 | B482: Germany | C482: Focus | D482: 155105 | E482: 3577.5
A483: 2019 | B483: Germany | C483: Ranger | D483: 179109 | E483: 7036.83
A484: 2019 | B484: Germany | C484: Endeavour | D484: 65081 | E484: 2036.91
A485: 2019 | B485: Brazil | C485: F-150 | D485: 144291 | E485: 4261.78
A486: 2019 | B486: Brazil | C486: Ranger | D486: 185602 | E486: 3781.83
A487: 2019 | B487: Brazil | C487: Endeavour | D487: 8270 | E487: 315.86
A488: 2019 | B488: China | C488: F-150 | D488: 131696 | E488: 5216.74
A489: 2019 | B489: China | C489: Fiesta | D489: 149243 | E489: 6327.01
A490: 2019 | B490: China | C490: Endeavour | D490: 185261 | E490: 6627.34
A491: 2019 | B491: Australia | C491: EcoSport | D491: 174063 | E491: 7754.85
A492: 2019 | B492: Australia | C492: Fiesta | D492: 32432 | E492: 950.48
A493: 2019 | B493: Australia | C493: Ranger | D493: 152102 | E493: 3815.63
A494: 2020 | B494: United States | C494: F-150 | D494: 41360 | E494: 977.83
A495: 2020 | B495: United States | C495: EcoSport | D495: 169737 | E495: 3511.52
A496: 2020 | B496: United States | C496: Fiesta | D496: 28612 | E496: 552.54999999999995
A497: 2020 | B497: United States | C497: Endeavour | D497: 104513 | E497: 4343.87
A498: 2020 | B498: India | C498: EcoSport | D498: 41980 | E498: 1534.24
A499: 2020 | B499: India | C499: Fiesta | D499: 32693 | E499: 1064.94
A500: 2020 | B500: India | C500: Focus | D500: 147487 | E500: 3335.86
A501: 2020 | B501: India | C501: Endeavour | D501: 106566 | E501: 2430.02
A502: 2020 | B502: United Kingdom | C502: EcoSport | D502: 64623 | E502: 2160.15
A503: 2020 | B503: United Kingdom | C503: Ranger | D503: 92758 | E503: 2717.07
A504: 2020 | B504: United Kingdom | C504: Endeavour | D504: 105850 | E504: 3582.18
A505: 2020 | B505: Germany | C505: F-150 | D505: 196042 | E505: 4196.28
A506: 2020 | B506: Germany | C506: Focus | D506: 125845 | E506: 3877.66
A507: 2020 | B507: Germany | C507: Ranger | D507: 37354 | E507: 865.42
A508: 2020 | B508: Brazil | C508: Focus | D508: 99168 | E508: 2335.8000000000002
A509: 2020 | B509: Brazil | C509: Ranger | D509: 93823 | E509: 2487.15
A510: 2020 | B510: Brazil | C510: Endeavour | D510: 58572 | E510: 2196.8000000000002
A511: 2020 | B511: China | C511: F-150 | D511: 120651 | E511: 3477.4
A512: 2020 | B512: China | C512: Fiesta | D512: 112889 | E512: 4500.43
A513: 2020 | B513: Australia | C513: Ranger | D513: 163552 | E513: 7074.44
A514: 2021 | B514: United States | C514: F-150 | D514: 168529 | E514: 3710.67
A515: 2021 | B515: United States | C515: Fiesta | D515: 61933 | E515: 1350.88
A516: 2021 | B516: United States | C516: Endeavour | D516: 87985 | E516: 3917.36
A517: 2021 | B517: India | C517: F-150 | D517: 120107 | E517: 5164.12
A518: 2021 | B518: India | C518: EcoSport | D518: 31051 | E518: 795.46
A519: 2021 | B519: India | C519: Fiesta | D519: 127490 | E519: 2392.6
A520: 2021 | B520: India | C520: Ranger | D520: 20947 | E520: 729.86
A521: 2021 | B521: United Kingdom | C521: F-150 | D521: 6111 | E521: 216.82
A522: 2021 | B522: United Kingdom | C522: Focus | D522: 199566 | E522: 7698.86
A523: 2021 | B523: Germany | C523: EcoSport | D523: 55993 | E523: 1208.3800000000001
A524: 2021 | B524: Germany | C524: Focus | D524: 57134 | E524: 2204.63
A525: 2021 | B525: Germany | C525: Ranger | D525: 154950 | E525: 4862.0200000000004
A526: 2021 | B526: Brazil | C526: F-150 | D526: 171982 | E526: 3100.66
A527: 2021 | B527: Brazil | C527: EcoSport | D527: 18045 | E527: 451.12
A528: 2021 | B528: Brazil | C528: Fiesta | D528: 159392 | E528: 5015.2700000000004
A529: 2021 | B529: China | C529: Endeavour | D529: 109912 | E529: 3685.68
A530: 2021 | B530: Australia | C530: Focus | D530: 35251 | E530: 1135.68